{
  "$schema": "https://json-schema.org/draft/2020-12/schema",
  "title": "Validation Results",
  "description": "Output of Stage 5 (Validate). Written by operator following validate.md prompt. Consumed by Stage 6 (PR creation).",
  "type": "object",
  "required": ["suite_a", "suite_b", "suite_c", "benchmark", "overall_verdict", "noise_cv"],
  "additionalProperties": false,
  "properties": {
    "suite_a": {
      "type": "object",
      "required": ["passed", "kendall_tau", "max_abs_error", "tuple_count"],
      "additionalProperties": false,
      "description": "Numeric fidelity and rank correlation results. passed=true when mean Kendall-tau > 0.8.",
      "properties": {
        "passed":        {"type": "boolean"},
        "kendall_tau":   {"type": "number", "minimum": -1, "maximum": 1},
        "max_abs_error": {"type": "number", "minimum": 0, "description": "Informational: max |sim_score - prod_score| across all tuples and endpoints"},
        "tuple_count":   {"type": "integer", "minimum": 0}
      }
    },
    "suite_b": {
      "type": "object",
      "required": ["passed", "rank_stability_tau", "threshold_crossing_pct", "informational_only"],
      "additionalProperties": false,
      "description": "Staleness rank stability. informational_only=true for all v1 transfers (staleness_window_ms=0).",
      "properties": {
        "passed":                  {"type": "boolean"},
        "rank_stability_tau":      {"type": "number", "minimum": -1, "maximum": 1},
        "threshold_crossing_pct":  {"type": "number", "minimum": 0, "maximum": 100},
        "informational_only":      {"type": "boolean", "description": "true for v1 (all signals have staleness_window_ms=0)"}
      }
    },
    "suite_c": {
      "type": "object",
      "required": ["passed", "deterministic", "max_pile_on_ratio"],
      "additionalProperties": false,
      "description": "Concurrent safety and pile-on check.",
      "properties": {
        "passed":            {"type": "boolean"},
        "deterministic":     {"type": "boolean", "description": "true if all 20 concurrent calls produced identical results"},
        "max_pile_on_ratio": {"type": "number", "minimum": 0, "description": "max selections / fair_share across 100 routing decisions"}
      }
    },
    "benchmark": {
      "type": "object",
      "required": ["passed", "mechanism_check_verdict", "t_eff"],
      "additionalProperties": false,
      "description": "Cluster benchmark mechanism check results.",
      "properties": {
        "passed":                   {"type": "boolean"},
        "mechanism_check_verdict":  {"type": "string", "enum": ["PASS", "FAIL", "INCONCLUSIVE", "ERROR"]},
        "t_eff":                    {"type": "number", "minimum": 0, "description": "Effective threshold from noise characterization"},
        "workload_classification":  {
          "type": "array",
          "items": {
            "type": "object",
            "required": ["workload", "classification"],
            "properties": {
              "workload":       {"type": "string"},
              "classification": {"type": "string", "enum": ["matched", "unmatched"]},
              "improvement":    {"type": "number"},
              "matched_signals": {"type": "array", "items": {"type": "string"}}
            }
          }
        },
        "specificity_notes": {
          "type": "array",
          "items": {"type": "string"},
          "description": "Informational: unmatched workloads where |change|/baseline >= T_eff (from CLI specificity_failures). Empty array if none."
        }
      }
    },
    "overall_verdict": {
      "type": "string",
      "enum": ["PASS", "FAIL", "INCONCLUSIVE"],
      "description": "PASS iff Suite A passed AND Suite C passed AND mechanism_check_verdict==PASS. Suite B excluded from v1 verdict (informational_only)."
    },
    "noise_cv": {
      "type": "number",
      "minimum": 0,
      "description": "Maximum CV across all metrics from noise characterization run"
    },
    "operator_notes": {
      "type": "string",
      "description": "Optional. Required when overall_verdict is INCONCLUSIVE (operator sign-off via Step 5 Option 4). Documents the rationale for proceeding despite INCONCLUSIVE benchmark verdict."
    }
  }
}
