{
  "suite_a": {"passed": true, "kendall_tau": 0.92, "max_abs_error": 0.05, "tuple_count": 100},
  "suite_b": {"passed": true, "rank_stability_tau": 0.95, "threshold_crossing_pct": 2.0, "informational_only": true},
  "suite_c": {"passed": true, "deterministic": true, "max_pile_on_ratio": 1.1},
  "benchmark": {
    "passed": true,
    "mechanism_check_verdict": "PASS",
    "t_eff": 0.05,
    "workload_classification": [
      {"workload": "chat-short", "classification": "matched",   "improvement": 0.1210, "matched_signals": ["queue_depth"]},
      {"workload": "code-gen",   "classification": "unmatched", "improvement": 0.0850, "matched_signals": []}
    ],
    "specificity_notes": []
  },
  "overall_verdict": "PASS",
  "noise_cv": 0.043
}
